Código;Descripción del producto;Valor exportado en 2016-M10;Valor exportado en 2016-M11;Valor exportado en 2016-M12;Valor exportado en 2017-M01;Valor exportado en 2017-M02;Valor exportado en 2017-M03;Valor exportado en 2017-M04;Valor exportado en 2017-M05;Valor exportado en 2017-M06;Valor exportado en 2017-M07;Valor exportado en 2017-M08;Valor exportado en 2017-M09;Valor exportado en 2017-M10;Valor exportado en 2017-M11;Valor exportado en 2017-M12;Valor exportado en 2018-M01;Valor exportado en 2018-M02;Valor exportado en 2018-M03;Valor exportado en 2018-M04
'090832;Cardamomo, triturada o pulverizada;0;0;0;0;0;0;0;0;0;0;0;0;0;9;0;0;0;0;0
'090910;"Semillas de anís, badiana, hinojo, cilantro, comino o alcaravea; bayas de enebro : Semillas ...";0;0;0;0;0;0;0;0;0;0;0;0;0;0;0;0;0;0;0
'090920;"Semillas de anís, badiana, hinojo, cilantro, comino o alcaravea; bayas de enebro : Semillas ...";0;0;0;0;0;0;0;0;0;0;0;0;0;0;0;0;0;0;0
'090921;Semillas de cilantro, sin triturar ni pulverizar;0;2;0;11;0;0;0;0;0;3;1;0;1;0;0;1;1;0;1
'090922;Semillas de cilantro, triturados o pulverizados;0;0;0;0;0;1;0;0;0;0;0;0;0;0;0;0;0;0;0
'090930;"Semillas de anís, badiana, hinojo, cilantro, comino o alcaravea; bayas de enebro : Semillas ...";0;0;0;0;0;0;0;0;0;0;0;0;0;0;0;0;0;0;0
'090931;Semillas de comino, sin triturar ni pulverizar;0;0;0;0;0;0;0;0;0;0;0;0;0;0;0;149;0;0;0
'090932;Semillas de comino, triturada o pulverizada;0;0;0;0;0;0;0;0;0;0;0;0;0;0;0;0;0;0;1
'090940;"Semillas de anís, badiana, hinojo, cilantro, comino o alcaravea; bayas de enebro : Semillas ...";0;0;0;0;0;0;0;0;0;0;0;0;0;0;0;0;0;0;0
'090950;"Semillas de anís, badiana, hinojo, cilantro, comino o alcaravea; bayas de enebro : Semillas ...";0;0;0;0;0;0;0;0;0;0;0;0;0;0;0;0;0;0;0
'090961;Bayas de enebro y las semillas de anís, badiana, alcaravea o hinojo, sin triturar ni pulverizar;0;0;0;0;0;0;0;0;0;0;0;0;0;0;0;0;0;0;0
'091010;Jengibre, azafrán, cúrcuma, tomillo, hojas de laurel, curri y demás especias : Jengibre;0;0;0;0;0;0;0;0;0;0;0;0;0;0;0;0;0;0;0
'091011;Jengibre, sin triturar ni pulverizar;0;0;0;0;0;0;0;0;0;0;3;4;0;0;30;0;0;0;0
'091012;Jengibre, triturados o pulverizados;0;0;0;0;0;0;0;0;0;0;0;0;0;0;0;0;0;0;0
'091020;Azafrán;0;0;0;0;0;0;0;0;0;0;0;0;0;0;0;0;0;0;0
'091030;Cúrcuma;0;0;0;0;0;1;0;0;0;0;0;0;2;0;12;1;0;0;0
'091040;Tomillo y hojas de laurel;0;0;0;0;0;0;0;0;0;0;0;0;0;0;0;0;0;0;0
'091050;Curry;0;0;0;0;0;0;0;0;0;0;0;0;0;0;0;0;0;0;0
'091091;Mezclas de especias diversas;2;0;0;2;2;0;0;0;0;0;0;0;0;0;0;0;0;0;0
'100110;Trigo y morcajo (tranquillón) : Trigo duro;0;0;0;0;0;0;0;0;0;0;0;0;0;0;0;0;0;0;0
'100119;Trigo duro (exc. ??las de siembra para siembra);0;0;0;0;0;0;0;0;0;0;0;0;0;0;0;0;0;0;0
'100190;Trigo y morcajo (tranquillón) : Los demás;0;0;0;0;0;0;0;0;0;0;0;0;0;0;0;0;0;0;0
'100199;Trigo y morcajo (exc. ??las de siembra para la siembra, y el trigo duro);0;0;0;0;0;0;0;0;0;0;0;0;0;0;0;0;0;0;0
'100200;Centeno;0;0;0;0;0;0;0;0;0;0;0;0;0;0;0;0;0;0;0
'100290;Centemp (exc. ??las semillas para siembra);0;0;0;0;0;0;0;0;0;0;0;0;0;0;0;0;0;0;0
'100300;Cebada;0;0;0;0;0;0;0;0;0;0;0;0;0;0;0;0;0;0;0
'100390;Cebada (exc. ??las de siembra para siembra);0;0;0;0;0;0;0;0;0;0;0;0;0;0;0;0;0;0;0
'100400;Avena;0;0;0;0;0;0;0;0;0;0;0;0;0;0;0;0;0;0;0
'100410;Avena para siembra;0;0;0;0;0;0;0;0;0;0;0;0;0;0;0;0;0;0;0
'100490;Avena (exc. ??las de siembra para siembra);0;0;0;0;0;0;0;0;0;0;0;0;0;0;0;0;1;0;0
'100610;"Arroz con cáscara o arroz ""paddy""";0;0;27;0;0;0;0;0;0;0;0;0;0;0;0;0;0;1;0
'100620;"Arroz descascarillado ""arroz cargo"" o ""arroz pardo""";0;0;0;0;0;0;0;0;0;0;0;0;0;0;0;0;0;0;1
'100640;Arroz partido;0;0;0;0;0;0;0;0;0;0;0;0;0;0;0;0;0;0;0
'100700;Sorgo de grano (granífero);0;0;0;0;0;0;0;0;0;0;0;0;0;0;0;0;0;0;0
'100790;Sorgo en grano (excepto para siembra);0;0;0;0;0;0;0;0;0;0;0;0;0;0;0;0;0;0;0
'100810;Alforfón;0;0;0;0;0;0;0;0;0;0;0;0;0;0;0;0;0;0;0
'100820;"Alforfón, mijo y alpiste; los demás cereales : Mijo";0;0;0;0;0;0;0;0;0;0;0;0;0;0;0;0;0;0;0
'100829;Mijo (sorgo de grano excluida, y la semilla para la siembra);0;0;0;0;0;0;0;0;0;0;0;0;0;0;0;0;0;0;0
'100830;Alpiste;0;0;1;0;0;0;0;0;0;0;0;0;0;0;0;0;0;0;0
'100850;"Quinua ""Chenopodium quinoa""";41;39;39;37;36;44;176;38;38;36;5;2;0;2;0;0;8;38;56
'100890;Cereales (excepto el trigo y morcajo, centeno, cebada, avena, maíz, arroz, sorgo, trigo sarraceno, ...;0;0;0;0;0;0;0;0;0;0;0;0;0;0;0;0;0;0;0
'120100;Habas (porotos, frijoles, fréjoles) de soja (soya), incluso quebrantadas;0;0;0;0;0;0;0;0;0;0;0;0;0;0;0;0;0;0;0
'120190;Habas de soja, incluso quebrantadas (exc. ??las de siembra para siembra);0;0;0;0;0;0;0;0;3;0;0;0;0;0;0;0;0;0;0
'120210;Cacahuetes (cacahuates, maníes) sin tostar ni cocer de otro modo, incluso sin cáscara o quebrantados ...;0;0;0;0;0;0;0;0;0;0;0;0;0;0;0;0;0;0;0
'120220;Cacahuetes (cacahuates, maníes) sin tostar ni cocer de otro modo, incluso sin cáscara o quebrantados ...;0;0;0;0;0;0;0;0;0;0;0;0;0;0;0;0;0;0;0
'120241;Cacahuetes, con cáscara (exc. ??las de siembra para la siembra, o maníes crudos);0;0;0;0;0;0;0;0;0;0;0;0;0;0;0;0;0;0;0
'120242;Cacahuetes sin cáscara, incluso quebrantados (exc. ??de semillas para la siembra, o maníes ...;0;0;0;0;0;0;0;0;0;0;0;0;0;0;0;0;0;0;0
'120510;"Semillas de nabo ""nabina"" o de colza con bajo contenido de ácido erúcico ""de las que se obtiene ...";0;0;0;0;0;0;0;0;0;0;0;0;0;0;0;0;0;0;0
'120590;"Semillas de nabo ""nabina"" o de colza con alto contenido de ácido erúcico ""de las que se obtiene ...";0;0;0;0;0;0;0;0;0;0;0;0;0;0;0;0;0;0;0
'120600;Semilla de girasol, incluso quebrantada;0;0;1;1;0;1;0;0;1;3;0;0;0;1;0;0;0;0;1
'120720;Las demás semillas y frutos oleaginosos, incluso quebrantados : Semilla de algodón;0;0;0;0;0;0;0;0;0;0;0;0;0;0;0;0;0;0;0
'120721;Semilla de algodón, para siembra;0;0;0;0;0;0;0;0;0;0;0;0;0;0;0;0;0;0;0
'120730;Semilla de ricino;0;0;0;0;0;0;0;0;0;0;0;0;0;0;0;0;0;0;0
'120740;"Semilla de sésamo ""ajonjolí"", incl. quebrantada";2;0;0;0;4;0;0;0;0;0;1;1;0;0;0;0;0;0;0
'120750;Semilla de mostaza, incl. quebrantada;0;0;0;0;0;0;0;0;0;0;0;0;0;0;0;0;0;0;0
'120760;"Cártamo ""Carthamus tinctorius"" semillas";0;0;0;0;0;0;0;0;0;0;0;0;0;0;0;0;0;0;0
'120791;"Semilla de amapola ""adormidera"", incl. quebrantada";0;0;0;0;0;0;0;0;0;0;0;0;0;0;0;0;0;0;0
'120810;"Harina de habas de soja ""soya""";0;0;0;0;0;0;0;0;0;0;0;0;0;0;0;0;0;0;0
'120890;"Harina de semillas o de frutos oleaginosos (exc. harina de mostaza y de habas de soja ""soya"")";0;0;0;0;0;0;0;0;0;0;0;0;0;0;0;0;0;0;0
'120910;Semilla de remolacha azucarera, para siembra;0;0;0;0;0;0;0;0;0;0;0;0;0;0;0;0;0;0;0
'120921;Semilla de alfalfa, para siembra;0;0;0;0;0;0;0;0;0;0;0;0;0;0;0;0;0;0;0
'120922;"Semilla de trébol ""Trifolium spp."", para siembra";0;0;0;0;0;0;0;0;0;0;0;0;0;0;0;0;0;0;0
'120923;Semilla de festucas, para siembra;0;0;0;0;0;0;0;0;0;0;0;0;0;0;0;0;0;0;0
'120924;"Semilla de pasto azul de Kentucky ""Poa pratensis L."", para siembra";0;0;0;0;0;0;0;0;0;0;0;0;0;0;0;0;0;0;0
'120925;"Semilla de ballico ""Lolium multiflorum Lam."", ""Lolium perenne L."", para siembra";0;0;0;0;0;0;0;0;0;0;0;0;0;0;0;0;0;0;0
'120929;Semillas forrajeras, para siembra (exc. de cereales, de remolacha azucarera, de alfalfa, de ...;0;0;0;0;0;0;0;0;0;0;0;0;0;0;0;0;0;0;0
'120930;Semillas de plantas herbáceas utilizadas principalmente por sus flores, para siembra;0;0;0;0;0;0;0;0;0;0;0;0;0;0;0;0;0;0;0
'120991;Semillas de hortalizas, para siembra;0;0;0;0;0;0;0;0;0;0;0;0;0;0;0;126;0;0;0
'120999;Semillas, frutos y esporas, para siembra (exc. legumbres, maíz dulce, café, té, yerba mate ...;0;0;0;0;0;0;0;0;0;0;0;3;0;0;4;27;0;4;28
'121020;"Conos de lúpulo, quebrantados, molidos o en ""pellets""; lupulino";0;0;0;0;0;0;0;0;0;5;8;0;38;41;82;0;0;0;0
'121110;Raíces de regaliz, frescas o secas, incl. cortadas, trituradas o pulverizadas;0;0;0;0;0;0;0;0;0;0;0;0;0;0;0;0;0;0;0
'121120;"Raíces de ""ginseng"", frescas o secas, incl. cortadas, trituradas o pulverizadas";0;0;0;0;0;0;0;0;0;0;0;0;0;0;0;0;0;0;0
'121130;Hojas de coca, frescas o secas, incl. cortadas, trituradas o pulverizadas;0;0;0;0;0;0;0;0;0;0;0;0;0;0;0;0;0;0;0
'121210;Algarrobas y sus semillas, frescas, refrigeradas, congeladas o secas, incl. pulverizadas;0;0;0;0;0;0;0;0;0;0;0;0;0;0;0;0;0;0;0
'121220;Algarrobas, algas, remolacha azucarera y caña de azúcar, frescas, refrigeradas, congeladas ...;0;0;0;0;0;0;0;0;0;0;0;0;0;0;0;0;0;0;0
'121221;Algas marinas y otras algas, frescas, refrigeradas, congeladas o secas, con o sin tierra, apta ...;0;0;2;0;0;0;0;0;0;0;0;0;0;0;0;0;0;0;0
'121229;Algas marinas y otras algas, frescas, refrigeradas, congeladas o secas, con o sin tierra, no ...;0;0;0;0;0;0;0;0;0;0;0;0;0;0;0;0;0;0;0
'121230;"Huesos ""carozos"" y almendras de albaricoque ""damasco, chabacano"", de melocotón ""durazno"", incl. ...";0;0;0;0;0;0;0;0;0;0;0;0;0;0;0;0;0;0;0
'121291;Remolacha azucarera, fresca, refrigerada, congelada o seca, incl. pulverizada;0;0;0;0;0;0;0;0;0;0;0;0;0;0;0;0;0;0;0
'121293;Caña de azúcar, fresca, refrigerada, congelada o seca, incl. pulverizada;0;0;0;0;0;0;0;0;0;0;0;0;0;0;0;0;0;0;0
'121299;Huesos y almendras de frutos y demás poductos vegetales, incl. las raíces de achicoria sin ...;0;0;0;0;5;0;0;0;0;0;1;0;16;0;0;0;0;0;0
'121300;Paja y cascabillo de cereales, en bruto, incluso picados, molidos, prensados o en pellets;0;0;11;3;0;0;0;0;0;0;0;0;0;0;0;0;0;1;0
'121410;"Harina y ""pellets"" de alfalfa";0;0;0;0;0;0;0;0;0;0;0;0;0;0;0;0;0;0;0
'121490;Nabos forrajeros, remolachas forrajeras, raíces forrajeras, heno, alfalfa, trébol, esparceta, ...;0;11;4;0;0;10;0;0;0;0;0;0;0;0;0;0;0;0;0
'140120;"Roten ""ratán""";0;0;0;0;0;0;0;0;0;0;0;0;0;0;0;0;0;0;0
'140190;Caña, junco, mimbre, rafia, paja de cereales, limpiada, blanqueada o teñida, corteza de tilo ...;2;3;1;0;4;1;5;2;0;0;8;0;2;0;0;0;0;0;5
'140200;«Kapok» [miraguano de bombacáceas], crin vegetal, crin marina y demás materias vegetales de ...;0;0;0;0;0;0;0;0;0;0;0;0;0;0;0;0;0;0;0
'140300;"Sorgo, piasava, grama, ixtle ""tampico"" y demás materias vegetales de las especies utilizadas ...";0;0;0;0;0;0;0;0;0;0;0;0;0;0;0;0;0;0;0
'140410;Materias primas vegetales de las especies utilizadas principalmente para teñir o curtir, n.c.o.p.;0;0;0;0;0;0;0;0;0;0;0;0;0;0;0;0;0;0;0
'140420;Línteres de algodón;33;0;0;0;0;0;0;0;0;0;0;0;0;0;0;0;0;0;0
'180200;Cáscara, películas y demás desechos de cacao;0;0;5;31;0;0;0;0;0;0;0;32;0;0;0;0;5;0;0
